{
  "schema_version": 2,
  "slice": "content-production",
  "status": "adopted",
  "unit_count": 44,
  "frames_per_unit": 240,
  "animations_per_unit": 72,
  "attempt_ledger": {
    "path": "assets/production/production-asset-attempts.json",
    "sha256": "f8374733827ad26ecde0b7fa4fccbb230c36f8348b0af9943282eef5eb036027",
    "attempt_count": 58
  },
  "review_record": {
    "path": ".pipeline/content-production/reviews/t18a-full-batch-claude-review.md",
    "sha256": "8f184279232c989c3697db289ef94cf5959fa1d72e74bfb8c4dc52c557ba1ec0"
  },
  "processor": {
    "python": "3.12.13",
    "python_implementation": "CPython",
    "pillow": "12.2.0",
    "numpy": "2.3.5",
    "script": "tools/content-production/build-production-assets.py",
    "script_sha256": "a430b03ef7371fbcf6046dd455ffc6968d879dd23440275e2330bb66632418e2"
  },
  "units": [
    {
      "unit_id": "unit.slice_monster_00",
      "status": "adopted",
      "adopted_attempt_id": "slice_monster_00-attempt-001",
      "source": {
        "path": "assets/production/attempts/slice_monster_00/attempt-001/raw.png",
        "sha256": "b89171f7ed1aad175d80d1ecfe22385e7b563dd3264ce518312b8407568bbd25"
      },
      "local_processing_seed": 1194479698,
      "outputs": {
        "source_sheet": "assets/production/source_sheets/slice_monster_00.png",
        "portrait": "assets/production/portraits/slice_monster_00.png",
        "board_icon": "assets/production/icons/board/slice_monster_00.png",
        "ability_icon": "assets/production/icons/abilities/slice_monster_00.png",
        "atlas": "assets/production/atlases/slice_monster_00.png",
        "sprite_frames": "assets/production/units/slice_monster_00.tres"
      },
      "sha256": {
        "source_sheet": "99f546331fb938daaca3e7c6057a51213686df5f0b43d00f76c991746d05be9e",
        "portrait": "e7ec2a2d9e13b89ff8b26b117939acee63a72054e969fae75cd35da77cdfe79b",
        "board_icon": "8e7361042cf04b88d7e0050041eace0980f9dee634f9257f73086add2f3647c8",
        "ability_icon": "1681d838cb19843577760eedb83d182b894cd1a88a6a42489c81c38860d0647d",
        "atlas": "7a0441b941caf3aef4df62b2eb8e285cea89b4bab0f7130ac44b470c36727118",
        "sprite_frames": "03e2eb89310bff5eed084bb35f2085423cb03b9a0de9b02dc857c3f3bed7a311"
      },
      "provenance": "assets/production/provenance/slice_monster_00.json"
    },
    {
      "unit_id": "unit.slice_monster_01",
      "status": "adopted",
      "adopted_attempt_id": "slice_monster_01-attempt-001",
      "source": {
        "path": "assets/production/attempts/slice_monster_01/attempt-001/raw.png",
        "sha256": "02f2351d0108e2251852a3f7f0cd869485ed6b3c4e79954381388d5aadd17faf"
      },
      "local_processing_seed": 1194479699,
      "outputs": {
        "source_sheet": "assets/production/source_sheets/slice_monster_01.png",
        "portrait": "assets/production/portraits/slice_monster_01.png",
        "board_icon": "assets/production/icons/board/slice_monster_01.png",
        "ability_icon": "assets/production/icons/abilities/slice_monster_01.png",
        "atlas": "assets/production/atlases/slice_monster_01.png",
        "sprite_frames": "assets/production/units/slice_monster_01.tres"
      },
      "sha256": {
        "source_sheet": "c85a3ede0c3c4573468c45d0fee78fda61ed99e56255049677a99ed0d7f7645f",
        "portrait": "2094cfd9a990a88e9038aa9ed7737e6df2f7e9af2e9be48e4706cc199a0f715a",
        "board_icon": "ee007126730d8e5c8c5ca5580c84bcf53c6152cf7bca422dde169b75882164d7",
        "ability_icon": "15cfe5ee27cae60d7838c59bb000f81ef12ee5919b3ffbde99a799ddb2bc88d9",
        "atlas": "1a243be8192f793a60cd44361d083f07bf4ebb192e049d4d659141f4b8ca51a0",
        "sprite_frames": "8ad875ce1200e5f4de5405947be433b3f27f303d7c874f3b67f0f896d160e366"
      },
      "provenance": "assets/production/provenance/slice_monster_01.json"
    },
    {
      "unit_id": "unit.slice_monster_02",
      "status": "adopted",
      "adopted_attempt_id": "slice_monster_02-attempt-001",
      "source": {
        "path": "assets/production/attempts/slice_monster_02/attempt-001/raw.png",
        "sha256": "623b1fb5cd912143637aade4d3f956afeefbd4537200dcec1dfd005cd938a07c"
      },
      "local_processing_seed": 1194479700,
      "outputs": {
        "source_sheet": "assets/production/source_sheets/slice_monster_02.png",
        "portrait": "assets/production/portraits/slice_monster_02.png",
        "board_icon": "assets/production/icons/board/slice_monster_02.png",
        "ability_icon": "assets/production/icons/abilities/slice_monster_02.png",
        "atlas": "assets/production/atlases/slice_monster_02.png",
        "sprite_frames": "assets/production/units/slice_monster_02.tres"
      },
      "sha256": {
        "source_sheet": "23ea2d4bf150dbde215a796287ba4b480705079969c7e0379d14a35fa1f195ed",
        "portrait": "9541640cf3af62f6aff1265947f8b1d197a0d9d17e9fbe44595797186a814ebe",
        "board_icon": "19249f6c8a2ed1b21a968aa3fd17c2ede46605390c3fb37b9e88ca7bcc412a67",
        "ability_icon": "6d872b94c147be00a9c284e8af810b1b407732c31e55f98606151b68467c59bc",
        "atlas": "917bc31cfbd28ab80ad4f89146b32005cc6097a31632397aa50723b233f59de2",
        "sprite_frames": "01129e157607dcb450a86b3963ba35c7fdb24b666bde6373f8c20f2b0bc93bac"
      },
      "provenance": "assets/production/provenance/slice_monster_02.json"
    },
    {
      "unit_id": "unit.slice_monster_03",
      "status": "adopted",
      "adopted_attempt_id": "slice_monster_03-attempt-001",
      "source": {
        "path": "assets/production/attempts/slice_monster_03/attempt-001/raw.png",
        "sha256": "25b86549237c34b7750bee4db62f41c75ffd2f3ccd5d58d9d86ad29f473fab53"
      },
      "local_processing_seed": 1194479701,
      "outputs": {
        "source_sheet": "assets/production/source_sheets/slice_monster_03.png",
        "portrait": "assets/production/portraits/slice_monster_03.png",
        "board_icon": "assets/production/icons/board/slice_monster_03.png",
        "ability_icon": "assets/production/icons/abilities/slice_monster_03.png",
        "atlas": "assets/production/atlases/slice_monster_03.png",
        "sprite_frames": "assets/production/units/slice_monster_03.tres"
      },
      "sha256": {
        "source_sheet": "7bcb5cc3967620db5c16b9de916459fd79120b7d6b9309a84b72c02ac29289fd",
        "portrait": "802c668561767f0d327bc6c8d4e001668c74eb152777a224059faf6f4c9c8b2a",
        "board_icon": "f2b30b89b50810eaf3d51e4dc9a5e58cd9281fccd582eaaafbb66b1cbbbcb741",
        "ability_icon": "2ad260fd89fe53500a5d39450357592afaf1e13cd9c07e6177a6aba0d5492f79",
        "atlas": "b494f97499a7133a3e2e0e7105a37e9b6b4224c285342f25cb381510fb5fde61",
        "sprite_frames": "1b1a9195edc83ae037e191fb3a690150b4e779821885a215a7ff4c9e4a247682"
      },
      "provenance": "assets/production/provenance/slice_monster_03.json"
    },
    {
      "unit_id": "unit.slice_monster_04",
      "status": "adopted",
      "adopted_attempt_id": "slice_monster_04-attempt-001",
      "source": {
        "path": "assets/production/attempts/slice_monster_04/attempt-001/raw.png",
        "sha256": "aec50f8e517e54ada0d80ed0675813c28de2aab81d5f9d88ff091da2e4820e4b"
      },
      "local_processing_seed": 1194479702,
      "outputs": {
        "source_sheet": "assets/production/source_sheets/slice_monster_04.png",
        "portrait": "assets/production/portraits/slice_monster_04.png",
        "board_icon": "assets/production/icons/board/slice_monster_04.png",
        "ability_icon": "assets/production/icons/abilities/slice_monster_04.png",
        "atlas": "assets/production/atlases/slice_monster_04.png",
        "sprite_frames": "assets/production/units/slice_monster_04.tres"
      },
      "sha256": {
        "source_sheet": "f8b9ffc21027d9a0a308b5ee5f187791289ca6f3f51347e13e7333c71e1ab721",
        "portrait": "cd1a0293af54ba7034fe648e9a229dada49b03ad0f06fb294d17e994700ec460",
        "board_icon": "3a2cad49c89a97f4c4489ac209fa0c3bd4ca33fa0361a1bef551a40ed4fdeefa",
        "ability_icon": "2f81a8d9fe985907d6a2889bde91c79388123d1e35aa3545c9e69e6eedea2b05",
        "atlas": "40ccdbd355d6b3e77b6e27c9d8419b9a423f445553a8db67d003f78e55d53a00",
        "sprite_frames": "88f6f6d8afb6db2f590c80ffd2184f6155054276b715ed951836a8fea63de27c"
      },
      "provenance": "assets/production/provenance/slice_monster_04.json"
    },
    {
      "unit_id": "unit.slice_monster_05",
      "status": "adopted",
      "adopted_attempt_id": "slice_monster_05-attempt-002",
      "source": {
        "path": "assets/production/attempts/slice_monster_05/attempt-002/raw.png",
        "sha256": "d1292e54f77a1daafb8fd22c9e4feab0f4b799ca28e695917b2e722f5f3a6a83"
      },
      "local_processing_seed": 1194479703,
      "outputs": {
        "source_sheet": "assets/production/source_sheets/slice_monster_05.png",
        "portrait": "assets/production/portraits/slice_monster_05.png",
        "board_icon": "assets/production/icons/board/slice_monster_05.png",
        "ability_icon": "assets/production/icons/abilities/slice_monster_05.png",
        "atlas": "assets/production/atlases/slice_monster_05.png",
        "sprite_frames": "assets/production/units/slice_monster_05.tres"
      },
      "sha256": {
        "source_sheet": "54c8d9b6a4345c7cbdc5d6712f8cb27bcde1ae4016c9e7b2ea5fb0e33a4500a0",
        "portrait": "02c6547651fcac7f14097506e2f3bcb64be82f766f8104747b6bd92e418eb9a2",
        "board_icon": "f69ef1e42bc9e03d9be6aa9ae7bda8a85de23c9bd3792db9e73fab6d4a21bca5",
        "ability_icon": "481b20aadc9600817177343514b3a2977d625ec591f71fb635a9839098c1225a",
        "atlas": "0afc3b098c39e15b61087fb56f042ae5d82a91f39489307a288f21ac8df437e3",
        "sprite_frames": "eddcfedb5a2e75f0caec7250582d054cd05cc2f627060d1420a12ffbd48060e8"
      },
      "provenance": "assets/production/provenance/slice_monster_05.json"
    },
    {
      "unit_id": "unit.slice_monster_06",
      "status": "adopted",
      "adopted_attempt_id": "slice_monster_06-attempt-001",
      "source": {